{
  "schema_version": 1,
  "build": {
    "id": "a5d09f7b-6c41-477e-8c31-1e967a5b3a4f",
    "attempt_id": "a5d09f7b-6c41-477e-8c31-1e967a5b3a4f",
    "attempt_number": 1,
    "correlation_id": "corr-build-a5d09f7b-trace-01"
  },
  "source": {
    "provider": "github",
    "repository": "summit-org/sample-service",
    "clone_url": "https://github.com/summit-org/sample-service.git",
    "branch": "main",
    "commit_sha": "e3b0c44298fc1c149afbf4c8996fb92427ae41e4",
    "root_directory": "/"
  },
  "build_config": {
    "builder": "railpack",
    "build_command": null,
    "install_command": null,
    "start_command": null,
    "dockerfile_path": null,
    "env_vars": {
      "NODE_ENV": "production",
      "PORT": "3000"
    }
  },
  "credentials": {
    "source_credential_ref": "secret:summit-build-a5d09f7b-6c41-477e-8c31-1e967a5b3a4f",
    "registry_credential_ref": "secret:ghcr-push"
  },
  "output": {
    "registry": "ghcr.io",
    "repository": "summit-org/summit-app-3f1c2a9e-7b0d-4e55-9a1c-0d2f6b8e4c11",
    "tag": "sha-e3b0c44298fc1c149afbf4c8996fb92427ae41e4",
    "platforms": [
      "linux/amd64"
    ]
  },
  "resources": {
    "cpu_millicores": 2000,
    "memory_mib": 4096,
    "ephemeral_storage_mib": 8192
  },
  "timeout_seconds": 1200,
  "reporting": {
    "endpoint": "http://summit-api.summit-system.svc.cluster.local:8080/internal/v1/builds",
    "token_ref": "secret:summit-build-a5d09f7b-6c41-477e-8c31-1e967a5b3a4f"
  }
}
